{
  "$schema": "http://json-schema.org/draft-07/schema#",
  "title": "Carapace Agent Identity Card",
  "description": "The badge — a cryptographically signed identity card for an autonomous AI agent.",
  "type": "object",
  "required": [
    "schema_version",
    "agent_id",
    "agent_name",
    "description",
    "protocol_version",
    "owner",
    "capabilities",
    "endpoints",
    "verification",
    "status",
    "created_at",
    "updated_at"
  ],
  "properties": {
    "schema_version": {
      "type": "string",
      "description": "Version of the identity card schema.",
      "const": "0.1.0"
    },
    "agent_id": {
      "type": "string",
      "format": "uuid",
      "description": "Permanent unique identifier for this agent. Never changes."
    },
    "agent_name": {
      "type": "string",
      "description": "Human-readable display name for the agent."
    },
    "description": {
      "type": "string",
      "description": "Brief description of the agent's purpose and capabilities."
    },
    "protocol_version": {
      "type": "string",
      "description": "Carapace protocol version this card conforms to.",
      "const": "0.1.0"
    },
    "owner": {
      "type": "object",
      "description": "The human or organization that created and controls this agent.",
      "required": ["owner_id", "display_name", "verified"],
      "properties": {
        "owner_id": {
          "type": "string",
          "description": "Namespaced identifier for the owner (e.g., 'github:user', 'did:key:...')."
        },
        "display_name": {
          "type": "string",
          "description": "Human-readable name of the owner."
        },
        "contact": {
          "type": "string",
          "description": "Contact URI or email for the owner."
        },
        "verified": {
          "type": "boolean",
          "description": "Whether the owner identity has been verified by the registry."
        }
      }
    },
    "capabilities": {
      "type": "array",
      "description": "Skills and functions this agent can perform.",
      "items": {
        "type": "object",
        "required": ["capability_id", "name", "description"],
        "properties": {
          "capability_id": {
            "type": "string",
            "description": "Unique identifier for this capability."
          },
          "name": {
            "type": "string",
            "description": "Human-readable name of the capability."
          },
          "description": {
            "type": "string",
            "description": "What this capability does."
          },
          "tags": {
            "type": "array",
            "items": { "type": "string" },
            "description": "Searchable tags for discovery."
          },
          "input_schema": {
            "type": "object",
            "description": "JSON Schema describing the expected input."
          },
          "output_schema": {
            "type": "object",
            "description": "JSON Schema describing the expected output."
          },
          "async_supported": {
            "type": "boolean",
            "default": false,
            "description": "Whether this capability supports asynchronous execution."
          }
        }
      }
    },
    "endpoints": {
      "type": "array",
      "description": "Network endpoints where this agent can be reached.",
      "items": {
        "type": "object",
        "required": ["url", "protocol"],
        "properties": {
          "url": {
            "type": "string",
            "format": "uri",
            "description": "Endpoint URL."
          },
          "protocol": {
            "type": "string",
            "enum": ["https", "a2a", "mcp", "grpc"],
            "description": "Protocol used at this endpoint."
          },
          "authentication": {
            "type": "object",
            "properties": {
              "type": {
                "type": "string",
                "enum": ["none", "bearer", "api_key", "oauth2"],
                "description": "Authentication mechanism."
              },
              "credentials_url": {
                "type": "string",
                "format": "uri",
                "description": "URL to obtain credentials (for oauth2)."
              }
            }
          }
        }
      }
    },
    "verification": {
      "type": "object",
      "description": "Cryptographic signature proving the card is authentic.",
      "required": ["algorithm", "public_key", "signature", "signed_at"],
      "properties": {
        "algorithm": {
          "type": "string",
          "enum": ["Ed25519", "ES256", "ES384"],
          "description": "Signing algorithm used."
        },
        "public_key": {
          "type": "string",
          "description": "Base64url-encoded public key of the owner."
        },
        "key_id": {
          "type": "string",
          "description": "Identifier for the signing key (for key rotation tracking)."
        },
        "signature": {
          "type": "string",
          "description": "Base64url-encoded signature over the canonicalized card (JCS / RFC 8785). Set to empty string during signing."
        },
        "signed_at": {
          "type": "string",
          "format": "date-time",
          "description": "UTC timestamp when the card was signed."
        }
      }
    },
    "registry": {
      "type": "object",
      "description": "Registry metadata. Set by the registry, not the owner.",
      "properties": {
        "node_id": {
          "type": "string",
          "description": "Identifier of the registry node that stores this card."
        },
        "registered_at": {
          "type": "string",
          "format": "date-time",
          "description": "UTC timestamp when the card was first registered."
        },
        "last_verified_at": {
          "type": "string",
          "format": "date-time",
          "description": "UTC timestamp of the last successful signature verification by the registry."
        },
        "federation_peers": {
          "type": "array",
          "items": { "type": "string" },
          "description": "Registry nodes that also hold a copy of this card."
        }
      }
    },
    "chain_anchors": {
      "type": "array",
      "description": "Blockchain or decentralized identity anchors for this agent.",
      "items": {
        "type": "object",
        "properties": {
          "chain": {
            "type": "string",
            "description": "Blockchain or DID network name."
          },
          "address": {
            "type": "string",
            "description": "On-chain address or DID."
          },
          "tx_hash": {
            "type": "string",
            "description": "Transaction hash anchoring the identity."
          }
        }
      }
    },
    "heartbeat": {
      "type": "object",
      "description": "Proactive agent schedule configuration.",
      "properties": {
        "interval_seconds": {
          "type": "integer",
          "description": "How often the agent checks in or runs its loop."
        },
        "last_seen": {
          "type": "string",
          "format": "date-time",
          "description": "UTC timestamp of the agent's last heartbeat."
        }
      }
    },
    "reputation": {
      "type": ["object", "null"],
      "description": "Trust scoring. Reserved for v0.2.0.",
      "default": null
    },
    "status": {
      "type": "string",
      "enum": ["active", "suspended", "revoked"],
      "description": "Lifecycle status of the agent identity."
    },
    "well_known_uri": {
      "type": "string",
      "format": "uri",
      "description": "URL where the A2A-compatible /.well-known/agent.json is hosted."
    },
    "metadata": {
      "type": "object",
      "description": "Extensible key-value store for custom fields.",
      "additionalProperties": true
    },
    "created_at": {
      "type": "string",
      "format": "date-time",
      "description": "UTC timestamp when the card was first created."
    },
    "updated_at": {
      "type": "string",
      "format": "date-time",
      "description": "UTC timestamp of the last modification."
    }
  },
  "additionalProperties": false
}
